id,pagefrom,title,description,sentanalyze,photolink,newslink
36,nur.kz,Музей мира и согласия ликвидируют в Нур-Султане,"Согласно постановлению, опубликованному на сайте, знаменитая ""пирамида"" перейдет ""Центру Нурсултана Назарбаева по развитию межконфессионального и межцивилизационного диалога"", который был создан в мае этого года.  Как передает телеканал ""Алматы"", ссылаясь на главу управления комитета по делам религий МИОР Мерекегуль Карабаеву, 18 сентября в ""пирамиде"" состоится секретариат съезда лидеров мировых и традиционных религий.  Кроме того, национальную картинную галерею ""Астана"", находившуюся во Дворце Мира и Согласия, исключают из списка особо важных объектов государственной собственности.  Но музей пока работает, пишет издание со ссылкой на Карабаеву.",-1,https://netstorage-nur.akamaized.net/images/a373fd93fa761116.jpeg?imwidth=900,https://www.nur.kz/1803455-muzej-mira-i-soglasia-likvidiruut-v-nur-sultane.html
37,tengrinews,Казахстанские сериалы: что смотреть на ivi,"Летние месяцы – лучшее время для того, чтобы окунуться в мир отличного юмора и развлечений. Особенно здорово потратить остаток лета на знакомство с работами казахстанских актеров и режиссеров. Специально для онлайн-сервиса IVI мы собрали подборку из самых смешных и качественных казахстанских сериалов – вы можете посмотреть их на сайте совершенно бесплатно.  Ата-ана. Бала-шага   Что случается, когда семейная пара с двумя подрастающими сыновьями переезжает из села Кордай в Алматы? Конечно же, всех членов семьи ждет трудная, но веселая адаптация к городской жизни. По мнению критиков, режиссер Асар Абулхаиров снял настоящий жизненный ситком, в котором роли заботливых родителей исполнили актеры Ерболат Алкожаев и Дарига Бадыкова. Родственная любовь, оптимизм и чувство юмора – вот рецепт, который спасает героев от ужасов мегаполиса.  Q-елі   Юмористический проект ""Q-елi"" знакомит зрителя с популярным и компактным жанром скетчкома – серии коротких комедийных сцен, не всегда связанных между собой по смыслу, но выходя",1,https://mix.tn.kz/userdata/news/2019/news_372705/thumb_b/photo_284994.jpg,https://mix.tn.kz/mixnews/kazahstanskie-serialyi-chto-smotret-na-ivi-372705/
38,nur.kz,"""Что стоит за этой красотой"": Масимов о работе Назарбаева на посту президента","Тизер картины опубликовал в своем Twitter пресс-секретарь Первого Президента Айдос Укибай.  ""Этот фильм мог бы иметь другие названия, как «Жизнь за кадром» или «Вне официального протокола». Однако в самом конце съемок у нас получился немного иной сюжет, который выходил за рамки задуманного"" , - рассказал о фильме Укибай. В фильме отечественные и зарубежные политики поделятся своим мнением о Нурсултане Назарбаеве и его работе на посту главы государства.  ""Мы видим его, когда все глянцевое. Как будто без проблем он выходит и принимает решения. Но что стоит за этой красотой, какие человеческие переживания?"" - приведены в картине слова Карима Масимова.",1,https://netstorage-nur.akamaized.net/images/2a223954d7ce4371.jpg?imwidth=900,https://www.nur.kz/1803460-cto-stoit-za-etoj-krasotoj-masimov-rasskazal-o-rabote-nazarbaeva-na-postu-prezidenta.html
39,nur.kz,Смартфон из золота за 2 млн тенге выпустили в честь Дня столицы,"Как передает телеканал, вдохновением для новой коллекции послужило переименование столицы в Нур-Султан.  В линейку вошли 4 товара.  Кнопочный телефон, который выполнен из золота 999-й пробы и украшен гербом страны и надписью с названием столицы. Цена за эксклюзивный мобильный - 1,5 млн тенге.",1,https://netstorage-nur.akamaized.net/images/81814cf5c3a575d6.png?imwidth=900,https://www.nur.kz/1803450-smartfon-iz-zolota-za-2-mln-tenge-vypustili-v-cest-dna-stolicy.html
40,tengrinews,Незабытый подвиг. Как двое солдат остановили бензовоз без тормозов ценою своей жизни,"Все в мире покроется пылью забвенья, Лишь двое не знают ни смерти, ни тленья: Лишь дело героя да речь мудреца Проходят столетья, не зная конца. Фирдоуси  Им было всего по 20 лет. Веселые солдаты, ожидающие дембель и возвращения к родным. И если бы не трагедия 1968 года, они бы этого обязательно дождались. TengriMIX в рамках проекта ""Герои среди нас"" вспоминает, как парни пожертвовали жизнью ради других.    Прошло больше полувека, однако, наверняка, есть те, кто все еще помнит злосчастный день лета 1968 года. 19 июня 20-летний рядовой Юра Директорчук сел за руль бензовоза и выехал из расположения части. В кабине находился его 22-летний напарник Анатолий Духович. Им было поручено развезти топливо по нескольким военным объектам.",1,https://mix.tn.kz/userdata/news/2019/news_372076/thumb_b/photo_284708.png,https://mix.tn.kz/mixnews/nezabyityiy-podvig-dvoe-soldat-ostanovili-benzovoz-tormozov-372076/
41,nur.kz,Шесть часов тушили крупнейший за последнее время пожар в Алматинской области,"В Алматинской области 40 гектаров выгорело из-за загоревшегося сухостоя. Пожар полыхал у трассы Алматы-Баканас. По словам очевидцев, в огне погибло множество степных животных, передает КТК.",-1,https://netstorage-nur.akamaized.net/images/73e9af343bc3d582.jpg?impolicy=common-image&imwidth=700,https://www.nur.kz/1803457-sest-casov-tusili-krupnejsij-za-poslednee-vrema-pozar-v-almatinskoj-oblasti-foto-video.html
42,tengrinews,Сангвиник-Наурыз и флегматик-кумыс. Как темперамент влияет на поведение и карьеру,"Все родители хотят видеть своих детей успешными и счастливыми. Для этого важно дать ребенку хороший старт. При этом нелишним будет проявить внимание и узнать его получше, чтобы родительский ""толчок"" помог взлететь, а не скатиться. Психолог Виктор Гребенников рассказал TengriMIX о том, как помочь ребенку, изучив детский темперамент, а также о том, какую работу лучше поручать людям с определенным характером.  Врач и философ Гиппократ делил людей на подвижных, шустрых сангвиников, страстных, вспыльчивых холериков, невозмутимых, неспешных флегматиков и впечатлительных, ранимых меланхоликов.  ""Темперамент определяется наследственностью и устойчиво проявляется в течение всей жизни человека. Его определяют при помощи специальных тестов. Также темперамент можно попробовать распознать самому. Например, сангвиник более активный, радостный, легкий на подъем; холерик - взрывной, скандальный человек, который не будет молчать; флегматик - уравновешенный, рассудительный; меланхолик - чуткий, с неравнодушием относящийся ко в",1,https://mix.tn.kz/userdata/news/2019/news_372347/thumb_b/photo_284874.jpg,https://mix.tn.kz/mixnews/sangvinik-nauryiz-flegmatik-kumyis-temperament-vliyaet-372347/
43,tengrinews,Собаки-ищейки научились выявлять рак легких с точностью 97 процентов,"Три собаки породы бигль успешно продемонстрировали, что они способны выявлять рак легких по запаху – первый шаг в выявлении специфических биомаркеров заболевания. Исследователи говорят, что способности собак могут привести к разработке эффективного, безопасного и недорогого средства для массового скрининга рака.  Спустя восемь недель обучения гончие собаки, выбранные за их превосходные обонятельные рецепторы, могли различать образцы сыворотки крови, взятые у пациентов со злокачественным раком легких, от здоровых контролей с 97-процентной точностью. Двойное слепое исследование опубликовано в июльском выпуске журнала американской ассоциации остеопатов.  Ученые использовали собак для разбора слоев запаха до выявления ими сигнальных биомаркеров. Собак заводили в комнату с образцами сыворотки крови на уровне носа. Некоторые образцы были взяты у пациентов с немелкоклеточным раком легкого; другие были взяты у здоровых контролей. После тщательного обнюхивания образца собаки садились, что указывало на положительный ре",1,https://mix.tn.kz/userdata/news/2019/news_372392/thumb_b/photo_284624.jpg,https://mix.tn.kz/mixnews/sobaki-ischeyki-nauchilis-vyiyavlyat-rak-legkih-tochnostyu-372392/
44,nur.kz,"Водителя автобуса, разбившего баллонным ключом автомобиль карагандинца, уволили","«Он уволен. Кроме того, он будет обязан за свой счет восстановить автомобиль, который он разбил баллонным ключом», - сообщил заведующим сектором ГУ «Отдел ЖКХ, пассажирского транспорта и автодорог» акимата Караганды Искандер Кабидулла. Автомобилист написал заявление в полицию, возбуждено уголовное дело по факту хулиганства.  Напомним, автовладелец сделал замечание водителю автобуса по поводу соблюдения правил дорожного движения. Тот отреагировал агрессивно и, покинув водительское кресло с баллонным ключом в руках, разбил переднюю часть авто.",1,https://netstorage-nur.akamaized.net/images/a088b628f68b4c3b.jpg?imwidth=900,https://www.nur.kz/1803454-voditela-avtobusa-razbivsego-ballonnym-klucom-avtomobil-karagandinca-uvolili.html
45,tengrinews,Одаренные дети Казахстана выступили с концертом в Алматы,"В театре Казахской национальной академии искусств имени Т. К. Жургенова состоялся заключительный гала-концерт IV Академии творчества Клубов ЮНЕСКО.  На мероприятии участники в возрасте от 12 до 18 лет из всех уголков Казахстана в номинациях музыкального, вокального и хореографического искусства продемонстрировали отточенные навыки в своих концертных номерах и выступили с популярной этно-фолк-группой ""Аркаим"".",1,https://mix.tn.kz/userdata/news/2019/news_372389/thumb_b/photo_284619.jpg,https://mix.tn.kz/mixnews/odarennyie-deti-kazahstana-vyistupili-s-kontsertom-v-almatyi-372389/
46,nur.kz,Влад Топалов и Регина Тодоренко сыграли свадьбу в Италии,"Российский певец Влад Топалов и украинская телеведущая Регина Тодоренко сыграли вторую свадьбу в Италии. Фото с празднования торжества появились в Instagram, передает NUR.KZ.",1,https://netstorage-nur.akamaized.net/images/8049630f721d795e.jpg?impolicy=common-image&imwidth=700,https://www.nur.kz/1803452-vlad-topalov-i-regina-todorenko-sygrali-svadbu-v-italii.html
47,tengrinews,Дизайнеры превратили страны-участницы Олимпиады-2020 в персонажей аниме,"У каждой страны, культуры есть свой уникальный характер, который художники стараются изобразить на своих холстах. Такую попытку предприняли и участники команды  World flags. Японские дизайнеры поразмыслили над тем, как бы выглядели страны-участницы Олимпийских игр в Токио, если бы они были людьми. О том, что у них получилось, в материале TengriMIX.  На Играх-2020 примут участие 205 государств. Местные дизайнеры в каждом из костюмов героев использовали элементы культуры государств-участников и изображения их флагов. Все персонажи выполнили в стиле аниме.",1,https://mix.tn.kz/userdata/news/2019/news_372095/thumb_b/photo_284561.jpg,https://mix.tn.kz/mixnews/dizayneryi-prevratili-stranyi-uchastnitsyi-olimpiadyi-2020-372095/
48,nur.kz,"""Белоснежка. Сказка для взрослых"" и другие интригующие премьеры этого сезона","Представляеи вам очередную порцию киноновинок в нашей сегодняшней подборке от Nurtv.kz. К примеру, фильм ""Мидуэй"", основанный на реальных событиях или комедийная драма ""Маленькие секреты большой компании"".",1,https://netstorage-nur.akamaized.net/images/61a5c38e9229d734.png?imwidth=900,https://www.nur.kz/1803378-belosnezka-skazka-dla-vzroslyh-i-drugie-intriguusie-premery-etogo-sezona.html
49,tengrinews,Почему растет интерес к персонализированному питанию,"Персонализированное питание все чаще становится объектом пристального внимания ученых и медиков. Самым крупным и широкомасштабным экспериментом в мире по изучению индивидуальных реакций организма на ту или иную пищу стало исследование под названием Predict, начатое в прошлом году профессором генетической эпидемиологии Королевского колледжа в Лондоне (Великобритания) Тимом Спектором и эпидемиологом Сарой Берри с участием профессора Эндрю Чана из Гарвардской медицинской школы (США) и других ученых.  Уникальность исследования также заключается в том, что в нем участвуют 700 идентичных близнецов. У них были собраны практически все данные о том, что может повлиять на обмен веществ в организме: состав микробиоты кишечника, продолжительность сна, уровень физической подготовки, структура жировой ткани и др. После приема стандартного набора блюд близнецов обследуют по трем показателям: уровни глюкозы, инсулина и триглицеридов в крови.  Исследование требует от участников выдержки и терпения. Сначала они в условиях стац",1,https://mix.tn.kz/userdata/news/2019/news_372285/thumb_b/photo_284495.jpg,https://mix.tn.kz/mixnews/pochemu-rastet-interes-k-personalizirovannomu-pitaniyu-372285/
50,nur.kz,Европа подверглась нашествию ядовитых гусениц походных шелкопрядов,"Германия, Голландия и другие европейские страны борются с нашествием гусениц дубовых походных шелкопрядов. Волоски на их теле токсичны для человека и могут вызвать аллергическую реакцию или раздражение кожи.",-1,https://netstorage-nur.akamaized.net/images/6ca41d31eb45effb.jpg?imwidth=900,https://www.nur.kz/1803451-evropa-podverglas-nasestviu-adovityh-gusenic-pohodnyh-selkopradov.html
51,nur.kz,Пострадавший в ДТП студент скончался в Алматы,"20-летний студент медуниверситета Асылбек Жумабаев, пострадавший в ДТП, скончался в Алматы. Печальную новость опубликовала Instagram-страница университета, передает NUR.KZ.",-1,https://netstorage-nur.akamaized.net/images/25af31b936129a6d.jpg?impolicy=common-image&imwidth=700,https://www.nur.kz/1803448-postradavsij-v-dtp-student-skoncalsa-v-almaty.html
52,tengrinews,"Взрыв, который сделал казахстанцев арысцами","Есть в Казахстане один город. В котором уже четыре раза за 10 лет взрываются боеприпасы. В последний раз было особенно громко и страшно. Трагедия напугала всех. TengriMIX рассказывает, как беда объединила казахстанцев и что мы можем сделать, чтобы подобное не повторилось.  Совсем недавно в Арыси жили 40 тысяч человек. Каждый был занят повседневными делами, мечтал, ходил на работу, растил детей... Сейчас же в городе только брошенные домашние животные, полицейские, пожарные и военные. А ведь всего около полутора месяцев назад все в стране говорили о том, как здорово, что у нас мирное небо над головой и не слышно залпов орудия...  Говорят, что горе обнажает человеческую душу. И если у одних были благородные ее порывы, то другие думали о собственной выгоде. И если одни повышали плату за такси для покидающих Арысь жителей, то другие торопились накормить их и напоить. И не важно, полицейские это были или простые жители. Главное, что дело делалось. А еще нашлись и третьи, которых обычно называют диванными войсками,",-1,https://mix.tn.kz/userdata/news/2019/news_372229/thumb_b/photo_284461.jpg,https://mix.tn.kz/mixnews/vzryiv-kotoryiy-sdelal-kazahstantsev-aryistsami-372229/
53,tengrinews,"""Справились! Но какой ценой?"" - ""Премьер-министр"" Ундасынов о вкладе Казахстана в победу в ВОВ","22 июня 1941 года в четыре часа утра фашистская Германия без объявления начала войну против Советского Союза.  В 12 часов дня нарком иностранных дел СССР Вячеслав Молотов выступил по радио с речью, в которой сообщил о нападении Германии и начале войны. Чуть позже его речь зачитал диктор Левитан. Так для советских граждан началась Великая Отечественная война. В Казахстане внезапно начавшаяся война, впрочем как и во всех других союзных республиках, разделила жизнь населения на два периода – довоенный и военный.  Началась глубокая перестройка всех отраслей народного хозяйства. Эта была очень сложная работа, которую нужно было осуществить в кратчайшее время, так как военное положение диктовало иные условия, иные сроки.  В осуществлении всех перечисленных мероприятий особая и главная роль принадлежала правительству республики, которое тогда именовалось Советом Народных Комиссаров Казахской ССР (с марта 1946 года – Совет министров Казахской ССР), возглавлял его Нуртас Дандыбаевич Ундасынов.  Нуртас Ундасынов был на",-1,https://mix.tn.kz/userdata/news/2019/news_372057/thumb_b/photo_284319.png,https://mix.tn.kz/mixnews/spravilis-kakoy-tsenoy-premer-ministr--undasyinov-vklade-372057/
